{
 "schema": "syncbridge.exchange",
 "schema_version": "0.1",
 "kind": "ae.probe.results",
 "event_id": "7ddf8b51-9f8a-3556-ed97-4346d8f96d64",
 "source_id": "ae",
 "revision": 0,
 "created": "2026-10-15T15:44:56+00:00",
 "app": {
  "name": "aftereffects",
  "version": "26.5x89"
 },
 "data": {
  "comp_fps": [
   24,
   1
  ],
  "environment": {
   "aeVersion": "26.5x89",
   "extendScript": "4.5.6"
  },
  "note": "Real AE 26.5 evaluation (valueAtTime) of SyncBridge probe vectors, 2026-10-16. Subset of probe run 2; see docs/PHASE0_RESEARCH.md section 8 #4.",
  "results": [
   {
    "name": "asymmetric_ease",
    "sentKeys": [
     {
      "time": 0,
      "value": 0,
      "inInterp": "LINEAR",
      "outInterp": "BEZIER",
      "inEase": {
       "speed": 0,
       "influence": 33.3333333333333
      },
      "outEase": {
       "speed": 0,
       "influence": 80
      }
     },
     {
      "time": 2,
      "value": 2,
      "inInterp": "BEZIER",
      "outInterp": "BEZIER",
      "inEase": {
       "speed": 1.5,
       "influence": 10
      },
      "outEase": {
       "speed": 1.5,
       "influence": 30
      }
     },
     {
      "time": 3,
      "value": 4,
      "inInterp": "BEZIER",
      "outInterp": "LINEAR",
      "inEase": {
       "speed": 0.22222222222222,
       "influence": 90
      },
      "outEase": {
       "speed": 0,
       "influence": 33.3333333333333
      }
     }
    ],
    "readKeys": [
     {
      "time": 0,
      "value": 0,
      "inInterp": "LINEAR",
      "outInterp": "BEZIER",
      "inEase": {
       "speed": 0,
       "influence": 16.666666667
      },
      "outEase": {
       "speed": 0,
       "influence": 80
      },
      "autoBezier": false,
      "continuous": false
     },
     {
      "time": 2,
      "value": 2,
      "inInterp": "BEZIER",
      "outInterp": "BEZIER",
      "inEase": {
       "speed": 1.5,
       "influence": 10
      },
      "outEase": {
       "speed": 1.5,
       "influence": 30
      },
      "autoBezier": false,
      "continuous": false
     },
     {
      "time": 3,
      "value": 4,
      "inInterp": "BEZIER",
      "outInterp": "LINEAR",
      "inEase": {
       "speed": 0.22222222222222,
       "influence": 90
      },
      "outEase": {
       "speed": 0,
       "influence": 16.666666667
      },
      "autoBezier": false,
      "continuous": false
     }
    ],
    "times": [
     0,
     0.00520833333333,
     0.01041666666667,
     0.015625,
     0.02083333333333,
     0.02604166666667,
     0.03125,
     0.03645833333333,
     0.04166666666667,
     0.046875,
     0.05208333333333,
     0.05729166666667,
     0.0625,
     0.06770833333333,
     0.07291666666667,
     0.078125,
     0.08333333333333,
     0.08854166666667,
     0.09375,
     0.09895833333333,
     0.10416666666667,
     0.109375,
     0.11458333333333,
     0.11979166666667,
     0.125,
     0.13020833333333,
     0.13541666666667,
     0.140625,
     0.14583333333333,
     0.15104166666667,
     0.15625,
     0.16145833333333,
     0.16666666666667,
     0.171875,
     0.17708333333333,
     0.18229166666667,
     0.1875,
     0.19270833333333,
     0.19791666666667,
     0.203125,
     0.20833333333333,
     0.21354166666667,
     0.21875,
     0.22395833333333,
     0.22916666666667,
     0.234375,
     0.23958333333333,
     0.24479166666667,
     0.25,
     0.25520833333333,
     0.26041666666667,
     0.265625,
     0.27083333333333,
     0.27604166666667,
     0.28125,
     0.28645833333333,
     0.29166666666667,
     0.296875,
     0.30208333333333,
     0.30729166666667,
     0.3125,
     0.31770833333333,
     0.32291666666667,
     0.328125,
     0.33333333333333,
     0.33854166666667,
     0.34375,
     0.34895833333333,
     0.35416666666667,
     0.359375,
     0.36458333333333,
     0.36979166666667,
     0.375,
     0.38020833333333,
     0.38541666666667,
     0.390625,
     0.39583333333333,
     0.40104166666667,
     0.40625,
     0.41145833333333,
     0.41666666666667,
     0.421875,
     0.42708333333333,
     0.43229166666667,
     0.4375,
     0.44270833333333,
     0.44791666666667,
     0.453125,
     0.45833333333333,
     0.46354166666667,
     0.46875,
     0.47395833333333,
     0.47916666666667,
     0.484375,
     0.48958333333333,
     0.49479166666667,
     0.5,
     0.50520833333333,
     0.51041666666667,
     0.515625,
     0.52083333333333,
     0.52604166666667,
     0.53125,
     0.53645833333333,
     0.54166666666667,
     0.546875,
     0.55208333333333,
     0.55729166666667,
     0.5625,
     0.56770833333333,
     0.57291666666667,
     0.578125,
     0.58333333333333,
     0.58854166666667,
     0.59375,
     0.59895833333333,
     0.60416666666667,
     0.609375,
     0.61458333333333,
     0.61979166666667,
     0.625,
     0.63020833333333,
     0.63541666666667,
     0.640625,
     0.64583333333333,
     0.65104166666667,
     0.65625,
     0.66145833333333,
     0.66666666666667,
     0.671875,
     0.67708333333333,
     0.68229166666667,
     0.6875,
     0.69270833333333,
     0.69791666666667,
     0.703125,
     0.70833333333333,
     0.71354166666667,
     0.71875,
     0.72395833333333,
     0.72916666666667,
     0.734375,
     0.73958333333333,
     0.74479166666667,
     0.75,
     0.75520833333333,
     0.76041666666667,
     0.765625,
     0.77083333333333,
     0.77604166666667,
     0.78125,
     0.78645833333333,
     0.79166666666667,
     0.796875,
     0.80208333333333,
     0.80729166666667,
     0.8125,
     0.81770833333333,
     0.82291666666667,
     0.828125,
     0.83333333333333,
     0.83854166666667,
     0.84375,
     0.84895833333333,
     0.85416666666667,
     0.859375,
     0.86458333333333,
     0.86979166666667,
     0.875,
     0.88020833333333,
     0.88541666666667,
     0.890625,
     0.89583333333333,
     0.90104166666667,
     0.90625,
     0.91145833333333,
     0.91666666666667,
     0.921875,
     0.92708333333333,
     0.93229166666667,
     0.9375,
     0.94270833333333,
     0.94791666666667,
     0.953125,
     0.95833333333333,
     0.96354166666667,
     0.96875,
     0.97395833333333,
     0.97916666666667,
     0.984375,
     0.98958333333333,
     0.99479166666667,
     1,
     1.00520833333333,
     1.01041666666667,
     1.015625,
     1.02083333333333,
     1.02604166666667,
     1.03125,
     1.03645833333333,
     1.04166666666667,
     1.046875,
     1.05208333333333,
     1.05729166666667,
     1.0625,
     1.06770833333333,
     1.07291666666667,
     1.078125,
     1.08333333333333,
     1.08854166666667,
     1.09375,
     1.09895833333333,
     1.10416666666667,
     1.109375,
     1.11458333333333,
     1.11979166666667,
     1.125,
     1.13020833333333,
     1.13541666666667,
     1.140625,
     1.14583333333333,
     1.15104166666667,
     1.15625,
     1.16145833333333,
     1.16666666666667,
     1.171875,
     1.17708333333333,
     1.18229166666667,
     1.1875,
     1.19270833333333,
     1.19791666666667,
     1.203125,
     1.20833333333333,
     1.21354166666667,
     1.21875,
     1.22395833333333,
     1.22916666666667,
     1.234375,
     1.23958333333333,
     1.24479166666667,
     1.25,
     1.25520833333333,
     1.26041666666667,
     1.265625,
     1.27083333333333,
     1.27604166666667,
     1.28125,
     1.28645833333333,
     1.29166666666667,
     1.296875,
     1.30208333333333,
     1.30729166666667,
     1.3125,
     1.31770833333333,
     1.32291666666667,
     1.328125,
     1.33333333333333,
     1.33854166666667,
     1.34375,
     1.34895833333333,
     1.35416666666667,
     1.359375,
     1.36458333333333,
     1.36979166666667,
     1.375,
     1.38020833333333,
     1.38541666666667,
     1.390625,
     1.39583333333333,
     1.40104166666667,
     1.40625,
     1.41145833333333,
     1.41666666666667,
     1.421875,
     1.42708333333333,
     1.43229166666667,
     1.4375,
     1.44270833333333,
     1.44791666666667,
     1.453125,
     1.45833333333333,
     1.46354166666667,
     1.46875,
     1.47395833333333,
     1.47916666666667,
     1.484375,
     1.48958333333333,
     1.49479166666667,
     1.5,
     1.50520833333333,
     1.51041666666667,
     1.515625,
     1.52083333333333,
     1.52604166666667,
     1.53125,
     1.53645833333333,
     1.54166666666667,
     1.546875,
     1.55208333333333,
     1.55729166666667,
     1.5625,
     1.56770833333333,
     1.57291666666667,
     1.578125,
     1.58333333333333,
     1.58854166666667,
     1.59375,
     1.59895833333333,
     1.60416666666667,
     1.609375,
     1.61458333333333,
     1.61979166666667,
     1.625,
     1.63020833333333,
     1.63541666666667,
     1.640625,
     1.64583333333333,
     1.65104166666667,
     1.65625,
     1.66145833333333,
     1.66666666666667,
     1.671875,
     1.67708333333333,
     1.68229166666667,
     1.6875,
     1.69270833333333,
     1.69791666666667,
     1.703125,
     1.70833333333333,
     1.71354166666667,
     1.71875,
     1.72395833333333,
     1.72916666666667,
     1.734375,
     1.73958333333333,
     1.74479166666667,
     1.75,
     1.75520833333333,
     1.76041666666667,
     1.765625,
     1.77083333333333,
     1.77604166666667,
     1.78125,
     1.78645833333333,
     1.79166666666667,
     1.796875,
     1.80208333333333,
     1.80729166666667,
     1.8125,
     1.81770833333333,
     1.82291666666667,
     1.828125,
     1.83333333333333,
     1.83854166666667,
     1.84375,
     1.84895833333333,
     1.85416666666667,
     1.859375,
     1.86458333333333,
     1.86979166666667,
     1.875,
     1.88020833333333,
     1.88541666666667,
     1.890625,
     1.89583333333333,
     1.90104166666667,
     1.90625,
     1.91145833333333,
     1.91666666666667,
     1.921875,
     1.92708333333333,
     1.93229166666667,
     1.9375,
     1.94270833333333,
     1.94791666666667,
     1.953125,
     1.95833333333333,
     1.96354166666667,
     1.96875,
     1.97395833333333,